{
  "$schema": "https://vchewing.github.io/valueadd/dualpin-schema-files/vChewing_dualpin_Schema.schema.json",
  "rawID": "dualPin.Unispim",
  "rawTitle": "Unispim",
  "localizedTitle": {
    "en": "Unispim",
    "zh-Hans": "紫光华宇",
    "zh-Hant": "紫光華宇",
    "ja": "紫光華宇"
  },
  "initials": {
    "zh": "u",
    "ch": "a",
    "sh": "i",
    "b": "b",
    "p": "p",
    "m": "m",
    "f": "f",
    "d": "d",
    "t": "t",
    "n": "n",
    "l": "l",
    "g": "g",
    "k": "k",
    "h": "h",
    "j": "j",
    "q": "q",
    "x": "x",
    "r": "r",
    "z": "z",
    "c": "c",
    "s": "s",
    "y": "y",
    "w": "w"
  },
  "finals": {
    "ao": "q",
    "en": "w",
    "e": "e",
    "an": "r",
    "eng": "t",
    "in": "y",
    "uai": "y",
    "u": "u",
    "i": "i",
    "o": "o",
    "uo": "o",
    "ai": "p",
    "a": "a",
    "ang": "s",
    "ie": "d",
    "ian": "f",
    "iang": "g",
    "uang": "g",
    "iong": "h",
    "ong": "h",
    "er": "j",
    "iu": "j",
    "ei": "k",
    "uan": "l",
    "van": "l",
    "ing": ";",
    "ou": "z",
    "ia": "x",
    "ua": "x",
    "v": "v",
    "iao": "b",
    "ue": "n",
    "ve": "n",
    "ui": "n",
    "un": "m",
    "vn": "m"
  },
  "nullOnset": "o",
  "keyInterception": "none",
  "autochopPolicy": "disabled"
}
