{
  "$schema": "https://vchewing.github.io/valueadd/dualpin-schema-files/vChewing_dualpin_Schema.schema.json",
  "rawID": "dualPin.Xiaohe",
  "rawTitle": "Xiaohe",
  "localizedTitle": {
    "en": "Xiaohe",
    "zh-Hans": "小鹤双拼",
    "zh-Hant": "小鶴雙拼",
    "ja": "小鶴双弁"
  },
  "initials": {
    "zh": "v",
    "ch": "i",
    "sh": "u",
    "b": "b",
    "p": "p",
    "m": "m",
    "f": "f",
    "d": "d",
    "t": "t",
    "n": "n",
    "l": "l",
    "g": "g",
    "k": "k",
    "h": "h",
    "j": "j",
    "q": "q",
    "x": "x",
    "r": "r",
    "z": "z",
    "c": "c",
    "s": "s",
    "y": "y",
    "w": "w"
  },
  "finals": {
    "iu": "q",
    "ei": "w",
    "e": "e",
    "uan": "r",
    "van": "r",
    "ue": "t",
    "ve": "t",
    "un": "y",
    "vn": "y",
    "u": "u",
    "i": "i",
    "o": "o",
    "uo": "o",
    "ie": "p",
    "a": "a",
    "iong": "s",
    "ong": "s",
    "ai": "d",
    "en": "f",
    "eng": "g",
    "ang": "h",
    "an": "j",
    "ing": "k",
    "uai": "k",
    "iang": "l",
    "uang": "l",
    "ou": "z",
    "ia": "x",
    "ua": "x",
    "ao": "c",
    "ui": "v",
    "v": "v",
    "in": "b",
    "iao": "n",
    "ian": "m"
  },
  "nullOnset": "finalInitialOrVerbatimDigraph",
  "keyInterception": "none",
  "autochopPolicy": "disabled",
  "aliases": {
    "ad": "ai",
    "aj": "an",
    "ac": "ao",
    "ew": "ei",
    "ef": "en",
    "oz": "ou"
  }
}
