{
  "$schema": "https://vchewing.github.io/valueadd/dualpin-schema-files/vChewing_dualpin_Schema.schema.json",
  "rawID": "dualPin.SmartABC",
  "rawTitle": "SmartABC",
  "localizedTitle": {
    "en": "Smart ABC",
    "zh-Hans": "智能ABC",
    "zh-Hant": "智能ABC",
    "ja": "知能ABC"
  },
  "initials": {
    "zh": "a",
    "ch": "e",
    "sh": "v",
    "b": "b",
    "p": "p",
    "m": "m",
    "f": "f",
    "d": "d",
    "t": "t",
    "n": "n",
    "l": "l",
    "g": "g",
    "k": "k",
    "h": "h",
    "j": "j",
    "q": "q",
    "x": "x",
    "r": "r",
    "z": "z",
    "c": "c",
    "s": "s",
    "y": "y",
    "w": "w"
  },
  "finals": {
    "ei": "q",
    "ian": "w",
    "e": "e",
    "er": "r",
    "iu": "r",
    "iang": "t",
    "uang": "t",
    "ing": "y",
    "u": "u",
    "i": "i",
    "o": "o",
    "uo": "o",
    "uan": "p",
    "van": "p",
    "a": "a",
    "iong": "s",
    "ong": "s",
    "ia": "d",
    "ua": "d",
    "en": "f",
    "eng": "g",
    "ang": "h",
    "an": "j",
    "ao": "k",
    "ai": "l",
    "iao": "z",
    "ie": "x",
    "in": "c",
    "uai": "c",
    "v": "v",
    "ue": "m",
    "ve": "m",
    "ui": "m",
    "un": "n",
    "vn": "n",
    "ou": "b"
  },
  "nullOnset": "o",
  "keyInterception": "none",
  "autochopPolicy": "disabled"
}
