{
  "$schema": "https://vchewing.github.io/valueadd/dualpin-schema-files/vChewing_dualpin_Schema.schema.json",
  "rawID": "dualPin.Sitong",
  "rawTitle": "Sitong",
  "localizedTitle": {
    "en": "Sitong",
    "zh-Hans": "四通双拼",
    "zh-Hant": "四通雙拼",
    "ja": "四通双弁"
  },
  "initials": {
    "zh": "a",
    "ch": "u",
    "sh": "i",
    "b": "b",
    "p": "p",
    "m": "m",
    "f": "f",
    "d": "d",
    "t": "t",
    "n": "n",
    "l": "l",
    "g": "g",
    "k": "k",
    "h": "h",
    "j": "j",
    "q": "q",
    "x": "x",
    "r": "r",
    "z": "z",
    "c": "c",
    "s": "s",
    "y": "y",
    "w": "w"
  },
  "finals": {
    "er": "q",
    "ei": "w",
    "en": "r",
    "eng": "t",
    "ong": "y",
    "iong": "y",
    "uo": "o",
    "ou": "p",
    "iang": "h",
    "uang": "h",
    "ian": "j",
    "iao": "k",
    "in": "l",
    "ing": ";",
    "un": "z",
    "vn": "z",
    "v": "x",
    "uai": "x",
    "uan": "c",
    "van": "c",
    "ui": "v",
    "ue": "v",
    "ve": "v",
    "ia": "b",
    "ua": "b",
    "iu": "n",
    "ie": "m",
    "ai": "s",
    "ao": "d",
    "an": "f",
    "ang": "g",
    "i": "i",
    "u": "u",
    "o": "o",
    "a": "a",
    "e": "e"
  },
  "nullOnset": "o",
  "keyInterception": "none",
  "autochopPolicy": "disabled",
  "aliases": {
    "jx": "ju",
    "qx": "qu",
    "xx": "xu",
    "yx": "yu"
  }
}
