{
  "$schema": "https://vchewing.github.io/valueadd/dualpin-schema-files/vChewing_dualpin_Schema.schema.json",
  "rawID": "dualPin.ZiranChou",
  "rawTitle": "ZiranChou",
  "localizedTitle": {
    "en": "Ziran (Zhou-Zhinong)",
    "zh-Hans": "自然双拼 (周志农)",
    "zh-Hant": "自然雙拼 (周志農)",
    "ja": "自然双弁 (周志農)"
  },
  "initials": {
    "zh": "v",
    "ch": "i",
    "sh": "u",
    "b": "b",
    "p": "p",
    "m": "m",
    "f": "f",
    "d": "d",
    "t": "t",
    "n": "n",
    "l": "l",
    "g": "g",
    "k": "k",
    "h": "h",
    "j": "j",
    "q": "q",
    "x": "x",
    "r": "r",
    "z": "z",
    "c": "c",
    "s": "s",
    "y": "y",
    "w": "w"
  },
  "finals": {
    "iu": "q",
    "ia": "w",
    "ua": "w",
    "e": "e",
    "uan": "r",
    "van": "r",
    "ue": "t",
    "ve": "t",
    "ing": "y",
    "uai": "y",
    "u": "u",
    "i": "i",
    "o": "o",
    "uo": "o",
    "un": "p",
    "vn": "p",
    "a": "a",
    "iong": "s",
    "ong": "s",
    "iang": "d",
    "uang": "d",
    "en": "f",
    "eng": "g",
    "ang": "h",
    "an": "j",
    "ao": "k",
    "ai": "l",
    "ei": "z",
    "ie": "x",
    "iao": "c",
    "ui": "v",
    "v": "v",
    "ou": "b",
    "in": "n",
    "ian": "m"
  },
  "nullOnset": "finalInitialOrVerbatimDigraph",
  "keyInterception": "none",
  "autochopPolicy": "disabled"
}
